{
  "budget_usd": 20.0,
  "contract": "0.2.0",
  "id": "00000000-0000-4000-8000-000000000001",
  "remaining_usd": 19.9930173,
  "reserved_usd": 0.0,
  "spent_usd": 0.0069827000000000005,
  "started": "2026-01-01T00:00:00.000Z",
  "tool": {
    "name": "squint",
    "version": "0.0.0"
  },
  "unresolved_usd": 0.0069827000000000005
}
